Date,Survey method,ID,Station,Location (OS coordinates),Habitat Lv.1,Habitat Lv.2,Habitat Lv.3
15/12/2016,Line transect,T1,1,SD 48505 57825,Woodland,Mixed,"Dense shrub layer, Sparse field layer"
15/12/2016,Line transect,T2,2,SD 490898 57188,Woodland,Broadleaved,"Moderate shrub layer, dense field layer"
15/12/2016,Line transect,T3,3,SD 48967 57379,Woodland,Broadleaved,"sparse shrub layer, dense field layer"
15/12/2016,Line transect,T4,4,SD 48333 57287,Woodland,Open land,Other field boundary (woodland to field margin)
15/12/2016,Line transect,T5,1,SD 49055 57362,Open land,Farmland,"Active farmland, Grazed"
